{"apiVersion":"delegation-resilience.org/v0alpha1","kind":"DelegationResilienceProfile","metadata":{"id":"refund-assistance","version":"0.1.0-alpha.1"},"spec":{"acceptabilityDecision":{"affectedPartyParticipation":[{"limitations":"Illustrative example; no real customer participation has occurred.","method":"complaint analysis and customer-panel review","party":"customers"},{"limitations":"Illustrative example; workload has not been measured.","method":"frontline workflow review","party":"customer-operations workers"}],"approvers":[{"id":"customer-operations-director","type":"human"},{"id":"customer-rights-review","type":"group"},{"id":"finance-risk","type":"group"}],"baselines":[{"description":"Human operator reviews and executes every refund.","id":"current-human-workflow"},{"description":"AI proposes a refund and a human executes every financial action.","id":"lower-autonomy"}],"constitutionalConstraints":[{"constraintId":"no-self-approval","deploymentRule":"prohibit_if_unsupported","source":"organizational separation-of-duties policy","statement":"The acting agent must not approve its own financial action."},{"constraintId":"retain-review-and-remedy","deploymentRule":"prohibit_if_unsupported","source":"customer rights policy","statement":"Customers retain a human review and remedy path during normal and degraded operation."}],"contestability":{"channel":"customer-support-review-queue","remedy":"Human review, correction, and financial recovery case when required.","reviewOwner":{"id":"customer-operations","type":"group"}},"criteria":{"constraintIntegrity":["no automatic retry while refund outcome is unknown","no refund above 10000 JPY without human approval","customer contestability remains available during degradation"],"missionAdequacy":["legitimate requests are resolved within 24 hours","backlog remains within the declared operating limit"]},"decisionOwner":{"id":"customer-operations-director","type":"human"},"harmCeilings":[{"affectedParty":"customers","ceiling":"No duplicate refund may be automatically retried while the external outcome is unknown.","harm":"duplicate refund followed by debt collection or account restriction","waiverPolicy":"not_waivable"},{"affectedParty":"customers","ceiling":"Every denial and delayed case must retain a human review channel.","harm":"loss of access to review and remedy","waiverPolicy":"not_waivable"}],"metadata":{"id":"refund-acceptability","version":"0.1.0-alpha.1"},"reviewTriggers":["refund policy changes","material customer complaint","model, connector, or provider change","exercise failure or inconclusive result"],"secondaryHarms":["stopping automation can delay time-sensitive refunds","excessive escalation can overload customer-operations workers"],"unresolvedDissent":["Customer and worker participation in this illustrative example has not occurred."],"validUntil":"2026-11-01T00:00:00Z"},"actions":[{"actionId":"read_order","compensation":{"classification":"not_required"},"idempotencyDomain":"order-id","irreversiblePoint":"none","metadata":{"id":"read-order","version":"0.1.0-alpha.1"},"nativeIdempotency":true,"outcomeProbe":{"authoritativeSource":"order-system","available":true},"requiredAuthority":"order:read","retryClass":"safe","sideEffectClass":"read_only"},{"actionId":"propose_refund","compensation":{"classification":"not_required"},"idempotencyDomain":"refund-intent-id","irreversiblePoint":"none","metadata":{"id":"propose-refund","version":"0.1.0-alpha.1"},"nativeIdempotency":true,"outcomeProbe":{"authoritativeSource":"recovery-evidence-store","available":true},"requiredAuthority":"refund:propose","retryClass":"safe","sideEffectClass":"proposal"},{"actionId":"execute_refund","compensation":{"classification":"unknown"},"idempotencyDomain":"refund-intent-id","irreversiblePoint":"refund provider accepts the financial instruction","metadata":{"id":"execute-refund","version":"0.1.0-alpha.1"},"nativeIdempotency":true,"outcomeProbe":{"authoritativeSource":"refund-provider","available":true},"requiredAuthority":"refund:execute","retryClass":"reconcile_before_retry","sideEffectClass":"transactional"},{"actionId":"notify_customer","compensation":{"classification":"irreversible"},"irreversiblePoint":"message is accepted by the delivery provider","metadata":{"id":"notify-customer","version":"0.1.0-alpha.1"},"nativeIdempotency":false,"outcomeProbe":{"authoritativeSource":"message-provider","available":true},"requiredAuthority":"customer:message","retryClass":"never_automatic","sideEffectClass":"communication"}],"attestationRefs":[],"delegationGrants":[{"actionRefs":["read_order","propose_refund","execute_refund","notify_customer"],"approvalConditions":["human approval is required above 10000 JPY","bank-account changes are not delegated"],"delegatee":{"id":"refund-agent-workload","type":"workload"},"delegator":{"id":"customer-operations","type":"group"},"grantId":"refund-agent-bounded-authority","metadata":{"id":"refund-agent-grant","version":"0.1.0-alpha.1"},"missionRef":"refund-resolution","policyGeneration":"draft-v0","quantitativeLimits":[{"dimension":"autonomous_refund_amount","operator":"max","unit":"JPY","value":10000}],"revocationConditions":["policy generation changes","exercise failure or contradictory evidence","abnormal refund volume"],"subdelegation":{"allowed":false,"maxDepth":0,"scopeNarrowingRequired":true},"validFrom":"2026-08-02T00:00:00Z","validUntil":"2026-11-01T00:00:00Z"}],"domainProfile":"transactional-action/v0alpha1","evidenceProfile":{"metadata":{"id":"refund-evidence","version":"0.1.0-alpha.1"},"requirements":[{"epistemicKind":"observed","evidenceId":"authorization-decision","freshness":"valid at commit point","independenceNotes":"Must not be produced by the acting agent.","missingDisposition":"deny","source":"local-policy-decision-point","stage":"decision"},{"epistemicKind":"reconciled","evidenceId":"refund-provider-outcome","freshness":"queried after timeout or response loss","independenceNotes":"Provider is authoritative for the financial effect but may share upstream dependencies.","missingDisposition":"reconcile","source":"refund-provider-status-api","stage":"external_outcome"},{"epistemicKind":"observed","evidenceId":"human-handover","freshness":"within 15 minutes of containment","independenceNotes":"Measure information, authority, workload, and task completion separately.","missingDisposition":"halt","source":"customer-operations-queue","stage":"recovery"}]},"exerciseScenarios":[{"claimRefs":["refund-provider-outage"],"executionPlan":{"parameters":[{"name":"initial_backlog","unit":"requests","value":100},{"name":"arrival_rate","unit":"requests_per_hour","value":5},{"name":"simulation_duration","unit":"hours","value":1},{"name":"response_loss_count","unit":"attempts","value":10},{"name":"operator_count","unit":"people","value":0}],"randomSeed":"refund-response-loss-v0alpha1-seed-1","sharedDependencies":["refund-provider-status-api"]},"exerciseMode":"deterministic_simulation","expectedObservations":["epistemic outcome becomes UNKNOWN rather than CONFIRMED_FAILED","no blind retry occurs","authoritative reconciliation resolves the outcome","duplicate refund count remains zero"],"injects":[{"atOffset":"after_provider_commit","duration":"0s","fault":"terminate the worker and drop the provider response","target":"refund-connector"}],"measurementConditions":["run the same fault schedule against the profile-aware workflow and a conventional retry baseline","record unknown duration, recovery time, operator workload, and duplicate effects"],"metadata":{"id":"response-loss-after-commit","version":"0.1.0-alpha.1"},"passCriteria":["every unknown outcome is reconciled or remains halted without a retry","duplicate refund count is exactly zero","all eligible requests in the exercise load are resolved within 24 hours","pending backlog never exceeds 100 requests"],"scenarioId":"refund-response-loss-after-commit"},{"claimRefs":["refund-provider-outage"],"executionPlan":{"dependencyAnalysisRequired":true,"dependencyTopology":[{"componentId":"primary-refund-worker","dependencyRefs":["shared-control-plane-idp","refund-authorization-policy","refund-provider-status-api"],"role":"primary_execution"},{"componentId":"fallback-refund-worker","dependencyRefs":["shared-control-plane-idp","refund-authorization-policy","refund-provider-status-api"],"role":"fallback_execution"},{"componentId":"refund-authorization-policy","dependencyRefs":["shared-control-plane-idp"],"role":"authorization"},{"componentId":"refund-provider-status-api","dependencyRefs":["shared-control-plane-idp"],"role":"external_outcome"},{"componentId":"customer-operations-channel","dependencyRefs":["shared-control-plane-idp","refund-authorization-policy","refund-provider-status-api"],"role":"human_handover"},{"componentId":"shared-control-plane-idp","dependencyRefs":[],"role":"other"}],"parameters":[{"name":"initial_backlog","unit":"requests","value":100},{"name":"arrival_rate","unit":"requests_per_hour","value":5},{"name":"fault_duration","unit":"hours","value":4},{"name":"operator_count","unit":"people","value":2},{"name":"operator_capacity","unit":"requests_per_person_hour","value":20},{"name":"authorization_guard_mode","unit":"mode","value":"fail_closed"}],"randomSeed":"refund-shared-idp-v0alpha1-seed-1","sharedDependencies":["shared-control-plane-idp"]},"exerciseMode":"deterministic_simulation","expectedObservations":["fallback is not reported as qualified","no execution path remains available through the shared dependency boundary","policy authorization and authoritative provider reconciliation are unavailable","the operator channel is unavailable through the same failure boundary","secondary harm from delayed refunds is recorded"],"injects":[{"atOffset":"before_fallback_activation","duration":"4h","fault":"make the identity boundary shared by primary execution, fallback execution, policy, provider outcome lookup, and the operator channel unavailable","target":"shared-control-plane-idp"}],"measure